{
  "$schema": "https://json-schema.org/draft/2020-12/schema",
  "title": "Каталог публикаций KRM РФ",
  "type": "array",
  "items": {
    "type": "object",
    "required": [
      "id",
      "type",
      "title",
      "url",
      "section",
      "datePublished",
      "dateModified",
      "excerpt",
      "image",
      "imageAlt",
      "seoTitle",
      "seoDescription"
    ],
    "properties": {
      "id": {
        "type": "string",
        "minLength": 1
      },
      "type": {
        "enum": [
          "article",
          "guide",
          "assessment",
          "dossier"
        ]
      },
      "title": {
        "type": "string",
        "minLength": 1
      },
      "url": {
        "type": "string",
        "pattern": "^/.+/$"
      },
      "section": {
        "enum": [
          "kremennaya",
          "svo",
          "lnr",
          "law",
          "civilian-impact",
          "politics",
          "assessment",
          "warcrimes"
        ]
      },
      "datePublished": {
        "type": "string",
        "format": "date"
      },
      "dateModified": {
        "type": "string",
        "format": "date"
      },
      "status": {
        "type": [
          "string",
          "null"
        ]
      },
      "excerpt": {
        "type": "string",
        "minLength": 1
      },
      "summary": {
        "type": "string",
        "minLength": 1
      },
      "image": {
        "type": "string",
        "pattern": "^/assets/img/"
      },
      "imageAlt": {
        "type": "string"
      },
      "period": {
        "type": "string"
      },
      "topics": {
        "type": "array",
        "items": {
          "type": "string"
        },
        "uniqueItems": true
      },
      "locations": {
        "type": "array",
        "items": {
          "type": "string"
        },
        "uniqueItems": true
      },
      "reviewedAt": {
        "type": "string",
        "format": "date"
      },
      "reviewAfter": {
        "type": "string",
        "format": "date"
      },
      "reviewCadenceDays": {
        "type": "integer",
        "minimum": 1,
        "maximum": 180
      },
      "reviewStatus": {
        "enum": [
          "current",
          "review-due",
          "superseded",
          "archived"
        ]
      },
      "supersededBy": {
        "type": "string",
        "pattern": "^/.+/$"
      },
      "revisionHistory": {
        "type": "array",
        "items": {
          "type": "object",
          "required": [
            "date",
            "summary"
          ],
          "properties": {
            "date": {
              "type": "string",
              "format": "date"
            },
            "summary": {
              "type": "string",
              "minLength": 1
            }
          },
          "additionalProperties": false
        }
      },
      "home": {
        "type": "object",
        "additionalProperties": false,
        "properties": {
          "important": {
            "type": "integer",
            "minimum": 1
          },
          "kremennaya": {
            "type": "integer",
            "minimum": 1
          },
          "guide": {
            "type": "integer",
            "minimum": 1
          },
          "dossier": {
            "type": "integer",
            "minimum": 1
          }
        }
      },
      "seoTitle": {
        "type": "string",
        "minLength": 1,
        "maxLength": 56
      },
      "seoDescription": {
        "type": "string",
        "minLength": 50,
        "maxLength": 160
      },
      "reviewBlocker": {
        "type": "string",
        "minLength": 1
      }
    },
    "allOf": [
      {
        "if": {
          "anyOf": [
            {
              "properties": {
                "type": {
                  "const": "guide"
                }
              },
              "required": [
                "type"
              ]
            },
            {
              "required": [
                "reviewedAt"
              ]
            },
            {
              "required": [
                "reviewAfter"
              ]
            },
            {
              "required": [
                "reviewCadenceDays"
              ]
            },
            {
              "required": [
                "reviewStatus"
              ]
            }
          ]
        },
        "then": {
          "required": [
            "reviewedAt",
            "reviewAfter",
            "reviewCadenceDays",
            "reviewStatus"
          ]
        }
      }
    ],
    "additionalProperties": true
  }
}
