[
  {
    "id": "assessment-2026-10-25",
    "type": "assessment",
    "title": "Оценка боевых действий СВО: Восточный ТВД, 19–25 октября 2026",
    "seoTitle": "Восточный ТВД: 19–25 октября 2026",
    "seoDescription": "Восточный ТВД 19–25 октября: Купянск, Боровая, Красный Лиман, Славянск; итоги недели, подтверждения, Кременная и гражданская обстановка ЛНР.",
    "url": "/assessment/2026-10-25/",
    "section": "assessment",
    "datePublished": "2026-10-25",
    "dateModified": "2026-10-25",
    "status": null,
    "excerpt": "После сентябрьских боёв российские подразделения удерживают позиции и активнее контратакуют под Красным Лиманом. Под Купянском укрепляется присутствие; ЛНР сталкивается с атаками БПЛА и проблемами связи.",
    "image": "/assets/img/assessment/2026-10-25/cover.webp",
    "imageAlt": "Еженедельная оценка обстановки на Восточном ТВД за 19–25 октября 2026 года",
    "period": "19–25 октября 2026 года; срез сообщений 24 октября включительно",
    "locations": [
      "Восточный фронт",
      "Купянск",
      "Боровая",
      "Красный Лиман",
      "Славянское направление",
      "Кременная",
      "ЛНР"
    ]
  },
  {
    "id": "zashchita-prav-lnr",
    "type": "guide",
    "title": "Куда жаловаться в ЛНР: свет, вода, жильё и отказы чиновников",
    "seoTitle": "Куда жаловаться в ЛНР: свет, вода, жильё и отказы",
    "seoDescription": "Как защитить права в ЛНР: запрет отключений за долг, аварии, компенсация за жильё, жалобы на администрацию. Адресаты, сроки и образцы обращений.",
    "url": "/news/reference/zashchita-prav-lnr/",
    "section": "law",
    "datePublished": "2026-10-23",
    "dateModified": "2026-10-23",
    "status": null,
    "excerpt": "Как защитить права в ЛНР: запрет отключений за долг, аварии, компенсация за жильё, жалобы на администрацию. Адресаты, сроки и образцы обращений.",
    "image": "/assets/img/news/reference/zashchita-prav-lnr/cover.webp",
    "imageAlt": "Обложка памятки «Куда жаловаться в ЛНР»: свет, вода, жильё и отказы чиновников",
    "topics": [
      "daily",
      "infrastructure",
      "safety"
    ],
    "locations": [
      "ЛНР",
      "Кременная"
    ],
    "reviewedAt": "2026-10-23",
    "reviewAfter": "2026-11-22",
    "reviewCadenceDays": 30,
    "reviewStatus": "current",
    "home": {
      "guide": 1
    },
    "revisionHistory": [
      {
        "date": "2026-10-23",
        "summary": "Проверены постановление № 931 в редакции от 2 октября 2026 года и порядок жалоб; добавлены ИИ-обложка и три датированные фотографии из опубликованного архива KRM РФ."
      }
    ]
  },
  {
    "id": "svo-2026-10-21",
    "type": "article",
    "title": "Что изменилось на фронте СВО к 21 октября 2026 года",
    "seoTitle": "Что изменилось на фронте СВО к 21 октября 2026 года",
    "seoDescription": "Фронт СВО к 21 октября 2026 года: Красный Лиман, Купянск, Доброполье, Волчанский котёл и Орехов. Итоги и изменения по карте KRM РФ.",
    "url": "/news/svo/svo-2026-10-21/",
    "section": "svo",
    "datePublished": "2026-10-21",
    "dateModified": "2026-10-21",
    "status": null,
    "excerpt": "Как изменился фронт после сентября: Красный Лиман, Купянск, взятие Доброполья, ситуация под Волчанском и баланс территорий по карте.",
    "image": "/assets/img/news/svo/svo-2026-10-21/cover.webp",
    "imageAlt": "Обзор фронта СВО к 21 октября 2026 года: иллюстрация к материалу KRM РФ",
    "period": "1–20 октября 2026 года; срез на утро 21 октября",
    "locations": [
      "Восточный фронт",
      "Красный Лиман",
      "Купянск",
      "Харьковское направление",
      "Славянское направление",
      "Боровая",
      "Константиновка",
      "Доброполье",
      "Запорожское направление",
      "Кременная",
      "ЛНР"
    ],
    "home": {
      "important": 1
    }
  },
  {
    "id": "propavshie-na-svo",
    "type": "article",
    "title": "Жив, погиб или в плену: почему о пропавших на СВО месяцами нет известий",
    "seoTitle": "Пропавшие на СВО: почему нет известий и что делать семье",
    "seoDescription": "Почему о пропавших на СВО месяцами нет известий. Как проверить сообщения о плене и ранении, разобраться с ДНК и обратиться за помощью без посредников.",
    "url": "/news/civilian-impact/propavshie-na-svo/",
    "section": "civilian-impact",
    "datePublished": "2026-10-14",
    "dateModified": "2026-10-14",
    "status": null,
    "excerpt": "Почему поиск затягивается, как проверять противоречивые сообщения, что могут установить МККК и ДНК и как семье действовать без платных посредников.",
    "image": "/assets/img/news/civilian-impact/propavshie-na-svo/cover.webp",
    "imageAlt": "Мужчина держит смартфон рядом с открытым ноутбуком",
    "period": "Объяснительный материал",
    "topics": [
      "civilian-impact"
    ],
    "locations": [
      "ЛНР",
      "Донбасс"
    ],
    "home": {
      "important": 2
    },
    "reviewedAt": "2026-10-14",
    "reviewAfter": "2026-11-13",
    "reviewCadenceDays": 30,
    "reviewStatus": "review-due"
  },
  {
    "id": "assessment-2026-10-11",
    "type": "assessment",
    "title": "Оценка боевых действий СВО: Восточный ТВД, 5–11 октября 2026",
    "seoTitle": "Восточный ТВД: 5–11 октября 2026",
    "seoDescription": "Восточный ТВД 5–11 октября: Заречное и Ямполь, Купянск-Узловой, позиционные бои и гражданская обстановка в Кременной и ЛНР.",
    "url": "/assessment/2026-10-11/",
    "section": "assessment",
    "datePublished": "2026-10-11",
    "dateModified": "2026-10-11",
    "status": null,
    "excerpt": "Заречное и Ямполь остаются спорными; по Купянску-Узловому появились новые заявления. Для жителей Кременной и ЛНР сохраняются риски БПЛА и ограничения транспорта.",
    "image": "/assets/img/assessment/2026-10-11/cover.webp",
    "imageAlt": "Восточный ТВД: обзорная иллюстрация к оценке за 5–11 октября 2026 года",
    "period": "5–11 октября 2026 года; сведения по КРМ РФ до 10 октября",
    "locations": [
      "Восточный фронт",
      "Купянск",
      "Боровая",
      "Красный Лиман",
      "Славянское направление",
      "Кременная",
      "ЛНР"
    ]
  },
  {
    "id": "chuzhaya-smert-ne-razvlechenie",
    "type": "article",
    "title": "Чужая смерть - не развлечение",
    "seoTitle": "Чужая смерть - не развлечение: о злорадстве на войне",
    "seoDescription": "Почему чужая смерть не должна становиться шуткой. О злорадстве на войне, гражданских, детях и границе, которую не отменяют флаги и убеждения.",
    "url": "/news/civilian-impact/chuzhaya-smert-ne-razvlechenie/",
    "section": "civilian-impact",
    "datePublished": "2026-10-09",
    "dateModified": "2026-10-25",
    "status": null,
    "excerpt": "Необязательно публично демонстрировать скорбь. Но нельзя превращать чужую смерть в праздник. О гражданских, бойцах и ответственности за собственные слова.",
    "image": "/assets/img/news/civilian-impact/chuzhaya-smert-ne-razvlechenie/cover.webp",
    "imageAlt": "Разрушенное здание пекарни и разбор завалов в Лисичанске после удара 3 февраля 2024 года",
    "period": "Авторский материал",
    "topics": [
      "civilian-impact",
      "daily"
    ],
    "locations": [
      "Донбасс",
      "ЛНР"
    ],
    "home": {
      "important": 1
    },
    "revisionHistory": [
      {
        "date": "2026-10-25",
        "summary": "В подписи отделены событие, дата кадра и версия следствия; неподтверждённая вина не выдана за установленный факт."
      }
    ]
  },
  {
    "id": "krm-2026-10-07",
    "type": "article",
    "title": "Кременная к 7 октября: тишина, перебои и обычная жизнь",
    "url": "/news/kremennaya/krm-2026-10-07/",
    "section": "kremennaya",
    "datePublished": "2026-10-07",
    "dateModified": "2026-10-07",
    "status": null,
    "excerpt": "К началу октября Кременная живёт в прифронтовой изоляции: дорога остаётся опасной, завозы редкими, свет нестабильным, а обычный день зависит от топлива, ремонта сетей и нескольких спокойных часов.",
    "image": "/assets/img/news/kremennaya/krm-2026-10-07/cover.jpg",
    "imageAlt": "Осенняя Кременная в конце сентября 2026 года",
    "period": "после 18 сентября — 7 октября 2026 года",
    "topics": [
      "safety",
      "daily",
      "infrastructure"
    ],
    "locations": [
      "Кременная",
      "Кременской район",
      "ЛНР"
    ],
    "seoTitle": "Кременная к 7 октября: тишина, перебои и обычная жизнь",
    "seoDescription": "Кременная к 7 октября: БПЛА и опасные дороги, нестабильный свет, ремонты воды, дорогой бензин, редкие завозы лекарств и жизнь прифронтового города.",
    "home": {
      "important": 1
    }
  },
  {
    "id": "assessment-2026-10-04",
    "type": "assessment",
    "title": "Оценка боевых действий СВО: Восточный ТВД, 28 сентября — 4 октября 2026",
    "seoTitle": "Восточный ТВД: 28 сентября — 4 октября 2026",
    "seoDescription": "Темп украинского давления у Красного Лимана снизился, но фронт остаётся фрагментированным; у Купянска заметнее локальная российская динамика.",
    "url": "/assessment/2026-10-04/",
    "section": "assessment",
    "datePublished": "2026-10-04",
    "dateModified": "2026-10-04",
    "status": null,
    "excerpt": "Темп украинского давления у Красного Лимана снизился, но устойчивой новой линии не возникло. У Купянска локальная российская динамика стала заметнее, Боровая осталась позиционной.",
    "image": "/assets/img/assessment/2026-10-04/cover.webp",
    "imageAlt": "Общая иллюстрация к оценке Восточного ТВД за 28 сентября — 4 октября 2026 года",
    "period": "28 сентября — 4 октября 2026 года",
    "locations": [
      "Восточный фронт",
      "Купянск",
      "Боровая",
      "Красный Лиман",
      "Славянское направление",
      "Кременная",
      "ЛНР"
    ]
  },
  {
    "id": "bpla-lnr-2026-10-02",
    "type": "article",
    "title": "Сентябрь под БПЛА: как изменились гражданские риски в ЛНР после лета",
    "seoTitle": "БПЛА в ЛНР в сентябре 2026: что изменилось после лета",